{
  "schemaVersion": 1,
  "id": "git-linux-ai-foundations",
  "title": "Git/Linux/AI Foundations",
  "technologyId": "tool",
  "moduleOrder": [
    "linux-foundations",
    "git-foundations",
    "ai-foundations"
  ],
  "prerequisites": [],
  "curriculumSlice": {
    "calendarDayIds": [
      "F1",
      "F2",
      "F3"
    ],
    "jsonPointers": [
      "/tracks/0/weeks/0/days/0",
      "/tracks/0/weeks/0/days/1",
      "/tracks/0/weeks/0/days/2"
    ]
  },
  "assessments": [
    "tooling-module-check"
  ],
  "courseLabs": [
    "ship-safe-change"
  ],
  "license": "proprietary-private",
  "owners": [
    "JesterCharles"
  ]
}
